{
  "$schema": "https://json-schema.org/draft/2020-12/schema",
  "type": "object",
  "additionalProperties": false,
  "required": [
    "schema_version",
    "skill",
    "language",
    "context",
    "sources",
    "content"
  ],
  "properties": {
    "schema_version": {
      "const": "1.0"
    },
    "skill": {
      "const": "tw-edu-exam-generator"
    },
    "language": {
      "const": "zh-TW"
    },
    "context": {
      "type": "object",
      "additionalProperties": false,
      "required": [
        "subject",
        "grade",
        "topic"
      ],
      "properties": {
        "subject": {
          "type": "string",
          "minLength": 1
        },
        "grade": {
          "type": "string",
          "minLength": 1
        },
        "topic": {
          "type": "string",
          "minLength": 1
        }
      }
    },
    "sources": {
      "type": "array",
      "items": {
        "type": "object",
        "additionalProperties": false,
        "required": [
          "title",
          "status"
        ],
        "properties": {
          "title": {
            "type": "string",
            "minLength": 1
          },
          "url": {
            "type": "string"
          },
          "status": {
            "enum": [
              "verified",
              "user_provided",
              "pending"
            ]
          }
        }
      }
    },
    "content": {
      "type": "object",
      "additionalProperties": false,
      "required": [
        "title",
        "expected_question_count",
        "total_points",
        "questions"
      ],
      "properties": {
        "title": {
          "type": "string",
          "minLength": 1
        },
        "expected_question_count": {
          "type": "integer",
          "minimum": 1
        },
        "total_points": {
          "type": "number",
          "exclusiveMinimum": 0
        },
        "questions": {
          "type": "array",
          "minItems": 1,
          "items": {
            "type": "object",
            "additionalProperties": false,
            "required": [
              "id",
              "type",
              "prompt",
              "points",
              "answer"
            ],
            "properties": {
              "id": {
                "type": "string",
                "minLength": 1
              },
              "type": {
                "enum": [
                  "multiple_choice",
                  "short_answer",
                  "essay",
                  "true_false"
                ]
              },
              "prompt": {
                "type": "string",
                "minLength": 1
              },
              "points": {
                "type": "number",
                "exclusiveMinimum": 0
              },
              "options": {
                "type": "array",
                "minItems": 2,
                "items": {
                  "type": "object",
                  "additionalProperties": false,
                  "required": [
                    "id",
                    "text"
                  ],
                  "properties": {
                    "id": {
                      "type": "string",
                      "minLength": 1
                    },
                    "text": {
                      "type": "string",
                      "minLength": 1
                    }
                  }
                }
              },
              "answer": {
                "type": "string",
                "minLength": 1
              },
              "explanation": {
                "type": "string",
                "minLength": 1
              }
            }
          }
        }
      }
    }
  }
}
