{
  "schema_version": "1.0",
  "skill": "tw-edu-exam-generator",
  "language": "zh-TW",
  "context": {
    "subject": "國語文",
    "grade": "國中八年級",
    "topic": "環境觀察"
  },
  "sources": [
    {
      "title": "教師提供教材",
      "status": "user_provided"
    }
  ],
  "content": {
    "title": "閱讀理解測驗（範例）",
    "expected_question_count": 1,
    "total_points": 10,
    "questions": [
      {
        "id": "Q1",
        "type": "multiple_choice",
        "prompt": "哪一項最符合文本主旨？",
        "points": 10,
        "options": [
          {
            "id": "A",
            "text": "觀察環境"
          },
          {
            "id": "B",
            "text": "計算距離"
          }
        ],
        "answer": "A",
        "explanation": "文本聚焦環境細節。"
      }
    ]
  }
}
